日期,指数代码,指数名称,指数英文名称,成分券代码,成分券名称,成分券英文名称,交易所,交易所英文名称,权重
2026-03-31,000300,沪深300,CSI 300,000001,平安银行,"Ping An Bank Co., Ltd.",深圳证券交易所,Shenzhen Stock Exchange,0.442
2026-03-31,000300,沪深300,CSI 300,000002,万科A,China Vanke Co Ltd,深圳证券交易所,Shenzhen Stock Exchange,0.112
2026-03-31,000300,沪深300,CSI 300,000063,中兴通讯,ZTE Corporation,深圳证券交易所,Shenzhen Stock Exchange,0.43
2026-03-31,000300,沪深300,CSI 300,000100,TCL科技,TCL Technology Group Corporation,深圳证券交易所,Shenzhen Stock Exchange,0.366
2026-03-31,000300,沪深300,CSI 300,000157,中联重科,Zoomlion Heavy Industry Science & Technology Co Ltd,深圳证券交易所,Shenzhen Stock Exchange,0.176
2026-03-31,000300,沪深300,CSI 300,000166,申万宏源,"Shenwan Hongyuan Group CO., LTD",深圳证券交易所,Shenzhen Stock Exchange,0.174
2026-03-31,000300,沪深300,CSI 300,000301,东方盛虹,"Jiangsu Eastern Shenghong Co.,Ltd.",深圳证券交易所,Shenzhen Stock Exchange,0.116
2026-03-31,000300,沪深300,CSI 300,000333,美的集团,"Midea Group CO., LTD",深圳证券交易所,Shenzhen Stock Exchange,1.547
2026-03-31,000300,沪深300,CSI 300,000338,潍柴动力,Wei Chai Power Co Ltd,深圳证券交易所,Shenzhen Stock Exchange,0.54
2026-03-31,000300,沪深300,CSI 300,000408,藏格矿业,ZANGGE MINING COMPANY LIMITED,深圳证券交易所,Shenzhen Stock Exchange,0.256
2026-03-31,000300,沪深300,CSI 300,000425,徐工机械,XCMG Construction Machinery Co Ltd,深圳证券交易所,Shenzhen Stock Exchange,0.39
2026-03-31,000300,沪深300,CSI 300,000538,云南白药,"Yunnan Baiyao Group Co., Ltd.",深圳证券交易所,Shenzhen Stock Exchange,0.201
2026-03-31,000300,沪深300,CSI 300,000568,泸州老窖,Luzhou Lao Jiao Co Ltd,深圳证券交易所,Shenzhen Stock Exchange,0.317
2026-03-31,000300,沪深300,CSI 300,000596,古井贡酒,Anhui Gujing Distillery Co Ltd,深圳证券交易所,Shenzhen Stock Exchange,0.069
2026-03-31,000300,沪深300,CSI 300,000617,中油资本,CNPC Capital Company Limited,深圳证券交易所,Shenzhen Stock Exchange,0.106
2026-03-31,000300,沪深300,CSI 300,000625,长安汽车,Chongqing Changan Automobile Co Ltd,深圳证券交易所,Shenzhen Stock Exchange,0.204
2026-03-31,000300,沪深300,CSI 300,000630,铜陵有色,Tongling Nonferrous Metals Group Co. Ltd,深圳证券交易所,Shenzhen Stock Exchange,0.192
2026-03-31,000300,沪深300,CSI 300,000651,格力电器,"Gree Electric Appliances,Inc. of Zhuhai",深圳证券交易所,Shenzhen Stock Exchange,0.698
2026-03-31,000300,沪深300,CSI 300,000661,长春高新,Chang Chun High and New Technology Industry (Group) Inc.,深圳证券交易所,Shenzhen Stock Exchange,0.115
2026-03-31,000300,沪深300,CSI 300,000708,中信特钢,"CITIC Pacific Special Steel Group Co., Ltd",深圳证券交易所,Shenzhen Stock Exchange,0.068
2026-03-31,000300,沪深300,CSI 300,000725,京东方A,BOE Technology Group Co Ltd,深圳证券交易所,Shenzhen Stock Exchange,0.591
2026-03-31,000300,沪深300,CSI 300,000768,中航西飞,AVIC XI'AN AIRCRAFT INDUSTRY GROUP COMPANY LTD.,深圳证券交易所,Shenzhen Stock Exchange,0.141
2026-03-31,000300,沪深300,CSI 300,000776,广发证券,"GF Securities Co., Ltd.",深圳证券交易所,Shenzhen Stock Exchange,0.218
2026-03-31,000300,沪深300,CSI 300,000786,北新建材,Beijing New Building Materials Public Ltd Co,深圳证券交易所,Shenzhen Stock Exchange,0.11
2026-03-31,000300,沪深300,CSI 300,000792,盐湖股份,Qinghai Salt Lake Industry Co Ltd,深圳证券交易所,Shenzhen Stock Exchange,0.484
2026-03-31,000300,沪深300,CSI 300,000807,云铝股份,Yunnan Aluminium Co Ltd,深圳证券交易所,Shenzhen Stock Exchange,0.265
2026-03-31,000300,沪深300,CSI 300,000858,五 粮 液,Wuliangye Yibin Co Ltd,深圳证券交易所,Shenzhen Stock Exchange,0.825
2026-03-31,000300,沪深300,CSI 300,000876,新 希 望,"NEW HOPE LIUHE CO., LTD",深圳证券交易所,Shenzhen Stock Exchange,0.076
2026-03-31,000300,沪深300,CSI 300,000895,双汇发展,Henan Shuanghui Investment & Development Co Ltd,深圳证券交易所,Shenzhen Stock Exchange,0.121
2026-03-31,000300,沪深300,CSI 300,000938,紫光股份,"Unisplendour Co., Ltd.",深圳证券交易所,Shenzhen Stock Exchange,0.205
2026-03-31,000300,沪深300,CSI 300,000963,华东医药,Huadong Medicine Co Ltd,深圳证券交易所,Shenzhen Stock Exchange,0.127
2026-03-31,000300,沪深300,CSI 300,000975,山金国际,"Shanjin International Gold Co.,Ltd.",深圳证券交易所,Shenzhen Stock Exchange,0.204
2026-03-31,000300,沪深300,CSI 300,000977,浪潮信息,"Inspur Electronic Information Industry Co.,Ltd",深圳证券交易所,Shenzhen Stock Exchange,0.237
2026-03-31,000300,沪深300,CSI 300,000983,山西焦煤,"Shanxi Coking Coal Energy Group Co.,Ltd.",深圳证券交易所,Shenzhen Stock Exchange,0.078
2026-03-31,000300,沪深300,CSI 300,000999,华润三九,China Resources Sanjiu Medical & Pharmaceutical Co Ltd,深圳证券交易所,Shenzhen Stock Exchange,0.077
2026-03-31,000300,沪深300,CSI 300,001391,国货航,"Air China Cargo Co., Ltd.",深圳证券交易所,Shenzhen Stock Exchange,0.021
2026-03-31,000300,沪深300,CSI 300,001965,招商公路,"China Merchants Expressway Network Technology Holdings Co., Ltd.",深圳证券交易所,Shenzhen Stock Exchange,0.083
2026-03-31,000300,沪深300,CSI 300,001979,招商蛇口,"CHINA MERCHANTS SHEKOU INDUSTRIAL ZONE HOLDINGS CO.,LTD",深圳证券交易所,Shenzhen Stock Exchange,0.125
2026-03-31,000300,沪深300,CSI 300,002001,新和成,Zhejiang NHU Co Ltd,深圳证券交易所,Shenzhen Stock Exchange,0.219
2026-03-31,000300,沪深300,CSI 300,002027,分众传媒,"Focus Media Information Technology Co., Ltd.",深圳证券交易所,Shenzhen Stock Exchange,0.273
2026-03-31,000300,沪深300,CSI 300,002028,思源电气,"Siyuan Electric Co., Ltd.",深圳证券交易所,Shenzhen Stock Exchange,0.518
2026-03-31,000300,沪深300,CSI 300,002049,紫光国微,"Unigroup Guoxin Microelectronics Co., Ltd.",深圳证券交易所,Shenzhen Stock Exchange,0.185
2026-03-31,000300,沪深300,CSI 300,002050,三花智控,"ZHEJIANG SANHUA INTELLIGENT CONTROLS CO.,LTD.",深圳证券交易所,Shenzhen Stock Exchange,0.392
2026-03-31,000300,沪深300,CSI 300,002074,国轩高科,"GUOXUAN HIGH-TECH CO.,LTD.",深圳证券交易所,Shenzhen Stock Exchange,0.159
2026-03-31,000300,沪深300,CSI 300,002142,宁波银行,Bank of Ningbo Co Ltd,深圳证券交易所,Shenzhen Stock Exchange,0.414
2026-03-31,000300,沪深300,CSI 300,002179,中航光电,"Jonhon Optronic Technology Co.,Ltd",深圳证券交易所,Shenzhen Stock Exchange,0.177
2026-03-31,000300,沪深300,CSI 300,002230,科大讯飞,"Iflytek Co.,Ltd.",深圳证券交易所,Shenzhen Stock Exchange,0.44
2026-03-31,000300,沪深300,CSI 300,002236,大华股份,Zhejiang Dahua Technology Co Ltd,深圳证券交易所,Shenzhen Stock Exchange,0.137
2026-03-31,000300,沪深300,CSI 300,002241,歌尔股份,GoerTek Inc,深圳证券交易所,Shenzhen Stock Exchange,0.228
2026-03-31,000300,沪深300,CSI 300,002252,上海莱士,Shanghai RAAS Blood Products Co Ltd,深圳证券交易所,Shenzhen Stock Exchange,0.127
2026-03-31,000300,沪深300,CSI 300,002304,洋河股份,Jiangsu Yanghe Brewery Joint-Stock Co Ltd,深圳证券交易所,Shenzhen Stock Exchange,0.126
2026-03-31,000300,沪深300,CSI 300,002311,海大集团,Guangdong Haid Group Co Ltd,深圳证券交易所,Shenzhen Stock Exchange,0.171
2026-03-31,000300,沪深300,CSI 300,002352,顺丰控股,"S.F. Holding Co., Ltd.",深圳证券交易所,Shenzhen Stock Exchange,0.376
2026-03-31,000300,沪深300,CSI 300,002371,北方华创,"NAURA Technology Group Co.,Ltd.",深圳证券交易所,Shenzhen Stock Exchange,0.797
2026-03-31,000300,沪深300,CSI 300,002384,东山精密,Suzhou Dongshan Precision Manufacturing Co Ltd,深圳证券交易所,Shenzhen Stock Exchange,0.545
2026-03-31,000300,沪深300,CSI 300,002415,海康威视,Hangzhou Hikvision Digital Technology Co Ltd,深圳证券交易所,Shenzhen Stock Exchange,0.459
2026-03-31,000300,沪深300,CSI 300,002422,科伦药业,Sichuan Kelun Pharmaceutical Co Ltd,深圳证券交易所,Shenzhen Stock Exchange,0.16
2026-03-31,000300,沪深300,CSI 300,002459,晶澳科技,"JA Solar Technology Co., Ltd.",深圳证券交易所,Shenzhen Stock Exchange,0.089
2026-03-31,000300,沪深300,CSI 300,002460,赣锋锂业,Ganfeng Lithium Co Ltd,深圳证券交易所,Shenzhen Stock Exchange,0.364
2026-03-31,000300,沪深300,CSI 300,002463,沪电股份,Wus Printed Circuit (Kunshan) Co Ltd,深圳证券交易所,Shenzhen Stock Exchange,0.421
2026-03-31,000300,沪深300,CSI 300,002466,天齐锂业,"Tianqi Lithium Industries, Inc.",深圳证券交易所,Shenzhen Stock Exchange,0.236
2026-03-31,000300,沪深300,CSI 300,002475,立讯精密,"Luxshare Precision Industry Co., Ltd.",深圳证券交易所,Shenzhen Stock Exchange,1.033
2026-03-31,000300,沪深300,CSI 300,002493,荣盛石化,Rongsheng Petro Chemical Co Ltd,深圳证券交易所,Shenzhen Stock Exchange,0.148
2026-03-31,000300,沪深300,CSI 300,002594,比亚迪,BYD Co Ltd,深圳证券交易所,Shenzhen Stock Exchange,1.177
2026-03-31,000300,沪深300,CSI 300,002600,领益智造,LINGYI iTECH (GUANGDONG) COMPANY,深圳证券交易所,Shenzhen Stock Exchange,0.193
2026-03-31,000300,沪深300,CSI 300,002601,龙佰集团,"LB Group Co., Ltd.",深圳证券交易所,Shenzhen Stock Exchange,0.12
2026-03-31,000300,沪深300,CSI 300,002625,光启技术,"Kuang-Chi Technologies Co., Ltd.",深圳证券交易所,Shenzhen Stock Exchange,0.238
2026-03-31,000300,沪深300,CSI 300,002648,卫星化学,"SATELLITE CHEMICAL CO., LTD.",深圳证券交易所,Shenzhen Stock Exchange,0.191
2026-03-31,000300,沪深300,CSI 300,002709,天赐材料,"Guangzhou Tinci Materials Technology Co., Ltd",深圳证券交易所,Shenzhen Stock Exchange,0.27
2026-03-31,000300,沪深300,CSI 300,002714,牧原股份,"Muyuan Foodstuff Co., Ltd",深圳证券交易所,Shenzhen Stock Exchange,0.469
2026-03-31,000300,沪深300,CSI 300,002736,国信证券,"GUOSEN SECURITIES CO., LTD.",深圳证券交易所,Shenzhen Stock Exchange,0.142
2026-03-31,000300,沪深300,CSI 300,002916,深南电路,"Shennan Circuits Co., Ltd.",深圳证券交易所,Shenzhen Stock Exchange,0.241
2026-03-31,000300,沪深300,CSI 300,002920,德赛西威,"Huizhou Desay SV Automotive Co., Ltd.",深圳证券交易所,Shenzhen Stock Exchange,0.128
2026-03-31,000300,沪深300,CSI 300,002938,鹏鼎控股,"Avary Holding (Shenzhen) Co., Limited",深圳证券交易所,Shenzhen Stock Exchange,0.149
2026-03-31,000300,沪深300,CSI 300,003816,中国广核,"CGN Power Co., Ltd.",深圳证券交易所,Shenzhen Stock Exchange,0.149
2026-03-31,000300,沪深300,CSI 300,300014,亿纬锂能,Eve Energy Co Ltd,深圳证券交易所,Shenzhen Stock Exchange,0.319
2026-03-31,000300,沪深300,CSI 300,300015,爱尔眼科,Aier Eye Hospital Group Co Ltd,深圳证券交易所,Shenzhen Stock Exchange,0.183
2026-03-31,000300,沪深300,CSI 300,300033,同花顺,"Hithink Royalflush Information Network Co.,Ltd.",深圳证券交易所,Shenzhen Stock Exchange,0.264
2026-03-31,000300,沪深300,CSI 300,300059,东方财富,East Money Information Co Ltd,深圳证券交易所,Shenzhen Stock Exchange,0.983
2026-03-31,000300,沪深300,CSI 300,300122,智飞生物,Chongqing Zhifei Biological Products Co Ltd,深圳证券交易所,Shenzhen Stock Exchange,0.074
2026-03-31,000300,沪深300,CSI 300,300124,汇川技术,Shenzhen Inovance Technology Co Ltd,深圳证券交易所,Shenzhen Stock Exchange,0.521
2026-03-31,000300,沪深300,CSI 300,300251,光线传媒,Beijing Enlight Media Co Ltd,深圳证券交易所,Shenzhen Stock Exchange,0.093
2026-03-31,000300,沪深300,CSI 300,300274,阳光电源,Sungrow Power Supply Co Ltd,深圳证券交易所,Shenzhen Stock Exchange,0.901
2026-03-31,000300,沪深300,CSI 300,300308,中际旭创,"ZHONGJI INNOLIGHT CO., LTD.",深圳证券交易所,Shenzhen Stock Exchange,2.604
2026-03-31,000300,沪深300,CSI 300,300316,晶盛机电,"Zhejiang Jingsheng Mechanical & Electrical Co., Ltd.",深圳证券交易所,Shenzhen Stock Exchange,0.111
2026-03-31,000300,沪深300,CSI 300,300347,泰格医药,"Hangzhou Tigermed Consulting Co., Ltd.",深圳证券交易所,Shenzhen Stock Exchange,0.114
2026-03-31,000300,沪深300,CSI 300,300394,天孚通信,"Suzhou TFC Optical Communication Co., Ltd.",深圳证券交易所,Shenzhen Stock Exchange,0.579
2026-03-31,000300,沪深300,CSI 300,300408,三环集团,"CHAOZHOU THREE-CIRCLE(GROUP)CO.,LTD",深圳证券交易所,Shenzhen Stock Exchange,0.292
2026-03-31,000300,沪深300,CSI 300,300413,芒果超媒,"Mango Excellent Media Co., Ltd.",深圳证券交易所,Shenzhen Stock Exchange,0.063
2026-03-31,000300,沪深300,CSI 300,300418,昆仑万维,"Beijing Kunlun Tech Co., Ltd.",深圳证券交易所,Shenzhen Stock Exchange,0.177
2026-03-31,000300,沪深300,CSI 300,300433,蓝思科技,"Lens Technology Co., Ltd.",深圳证券交易所,Shenzhen Stock Exchange,0.23
2026-03-31,000300,沪深300,CSI 300,300442,润泽科技,Range Intelligent Computing Technology Group Company Limited,深圳证券交易所,Shenzhen Stock Exchange,0.272
2026-03-31,000300,沪深300,CSI 300,300476,胜宏科技,"Victory Giant Technology (HuiZhou)Co.,Ltd.",深圳证券交易所,Shenzhen Stock Exchange,0.629
2026-03-31,000300,沪深300,CSI 300,300498,温氏股份,"GUANGDONGWENSFOODSTUFFGROUPCO.,LTD",深圳证券交易所,Shenzhen Stock Exchange,0.364
2026-03-31,000300,沪深300,CSI 300,300502,新易盛,"Eoptolink Technology Inc., Ltd",深圳证券交易所,Shenzhen Stock Exchange,1.812
2026-03-31,000300,沪深300,CSI 300,300628,亿联网络,YEALINK NETWORK TECHNOLOGY CORPORATION LIMITED,深圳证券交易所,Shenzhen Stock Exchange,0.068
2026-03-31,000300,沪深300,CSI 300,300661,圣邦股份,SG Micro Corp.,深圳证券交易所,Shenzhen Stock Exchange,0.12
2026-03-31,000300,沪深300,CSI 300,300750,宁德时代,"Contemporary Amperex Technology Co., Limited.",深圳证券交易所,Shenzhen Stock Exchange,4.372
2026-03-31,000300,沪深300,CSI 300,300759,康龙化成,"Pharmaron Beijing Co., Ltd.",深圳证券交易所,Shenzhen Stock Exchange,0.119
2026-03-31,000300,沪深300,CSI 300,300760,迈瑞医疗,"Shenzhen Mindray Bio-Medical Electronics Co., Ltd.",深圳证券交易所,Shenzhen Stock Exchange,0.411
2026-03-31,000300,沪深300,CSI 300,300782,卓胜微,Maxscend Microelectronics Company Limited,深圳证券交易所,Shenzhen Stock Exchange,0.123
2026-03-31,000300,沪深300,CSI 300,300803,指南针,"Beijing Compass Technology Development Co., Ltd.",深圳证券交易所,Shenzhen Stock Exchange,0.144
2026-03-31,000300,沪深300,CSI 300,300832,新产业,"Shenzhen New Industries Biomedical Engineering Co., Ltd.",深圳证券交易所,Shenzhen Stock Exchange,0.079
2026-03-31,000300,沪深300,CSI 300,300866,安克创新,"Anker Innovations Technology Co., Ltd",深圳证券交易所,Shenzhen Stock Exchange,0.095
2026-03-31,000300,沪深300,CSI 300,300896,爱美客,"IMEIK TECHNOLOGY DEVELOPMENT CO.,LTD.",深圳证券交易所,Shenzhen Stock Exchange,0.073
2026-03-31,000300,沪深300,CSI 300,300979,华利集团,Huali Industrial Group Company Limited,深圳证券交易所,Shenzhen Stock Exchange,0.031
2026-03-31,000300,沪深300,CSI 300,300999,金龙鱼,"Yihai Kerry Arawana Holdings Co., Ltd",深圳证券交易所,Shenzhen Stock Exchange,0.07
2026-03-31,000300,沪深300,CSI 300,301236,软通动力,"iSoftStone Information Technology (Group) Co., Ltd.",深圳证券交易所,Shenzhen Stock Exchange,0.094
2026-03-31,000300,沪深300,CSI 300,301269,华大九天,"Empyrean Technology Co., Ltd.",深圳证券交易所,Shenzhen Stock Exchange,0.073
2026-03-31,000300,沪深300,CSI 300,302132,中航成飞,AVIC CHENGDU AIRCRAFT COMPANY LIMITED,深圳证券交易所,Shenzhen Stock Exchange,0.081
2026-03-31,000300,沪深300,CSI 300,600000,浦发银行,Shanghai Pudong Development Bank Co Ltd,上海证券交易所,Shanghai Stock Exchange,0.558
2026-03-31,000300,沪深300,CSI 300,600009,上海机场,Shanghai International Airport Co Ltd,上海证券交易所,Shanghai Stock Exchange,0.141
2026-03-31,000300,沪深300,CSI 300,600010,包钢股份,Inner Mongolia Baotou Steel Union Co Ltd,上海证券交易所,Shanghai Stock Exchange,0.234
2026-03-31,000300,沪深300,CSI 300,600011,华能国际,Huaneng Power International Inc,上海证券交易所,Shanghai Stock Exchange,0.127
2026-03-31,000300,沪深300,CSI 300,600015,华夏银行,Hua Xia Bank Co Ltd,上海证券交易所,Shanghai Stock Exchange,0.192
2026-03-31,000300,沪深300,CSI 300,600016,民生银行,China Minsheng Banking Corp Ltd,上海证券交易所,Shanghai Stock Exchange,0.387
2026-03-31,000300,沪深300,CSI 300,600018,上港集团,Shanghai International Port (Group) Co Ltd,上海证券交易所,Shanghai Stock Exchange,0.059
2026-03-31,000300,沪深300,CSI 300,600019,宝钢股份,Baoshan Iron &Steel Co Ltd,上海证券交易所,Shanghai Stock Exchange,0.23
2026-03-31,000300,沪深300,CSI 300,600023,浙能电力,"Zhejiang Zheneng Electric Power Co., Ltd.",上海证券交易所,Shanghai Stock Exchange,0.09
2026-03-31,000300,沪深300,CSI 300,600025,华能水电,HuanengLancang River Hydropower Inc.,上海证券交易所,Shanghai Stock Exchange,0.076
2026-03-31,000300,沪深300,CSI 300,600026,中远海能,"COSCO SHIPPING Energy Transportation Co., Ltd.",上海证券交易所,Shanghai Stock Exchange,0.151
2026-03-31,000300,沪深300,CSI 300,600027,华电国际,Huadian Power International Corporation Ltd,上海证券交易所,Shanghai Stock Exchange,0.077
2026-03-31,000300,沪深300,CSI 300,600028,中国石化,China Petroleum & Chemical Corporation,上海证券交易所,Shanghai Stock Exchange,0.353
2026-03-31,000300,沪深300,CSI 300,600029,南方航空,China Southern Airlines Co Ltd,上海证券交易所,Shanghai Stock Exchange,0.125
2026-03-31,000300,沪深300,CSI 300,600030,中信证券,CITIC Securities Co Ltd,上海证券交易所,Shanghai Stock Exchange,0.966
2026-03-31,000300,沪深300,CSI 300,600031,三一重工,Sany Heavy Industry Co Ltd,上海证券交易所,Shanghai Stock Exchange,0.469
2026-03-31,000300,沪深300,CSI 300,600036,招商银行,China Merchants Bank Co Ltd,上海证券交易所,Shanghai Stock Exchange,2.003
2026-03-31,000300,沪深300,CSI 300,600039,四川路桥,Sichuan Road&Bridge Co Ltd,上海证券交易所,Shanghai Stock Exchange,0.108
2026-03-31,000300,沪深300,CSI 300,600048,保利发展,"Poly Developments and Holdings Group Co., Ltd.",上海证券交易所,Shanghai Stock Exchange,0.172
2026-03-31,000300,沪深300,CSI 300,600050,中国联通,China United Network Communications Co Ltd,上海证券交易所,Shanghai Stock Exchange,0.286
2026-03-31,000300,沪深300,CSI 300,600061,国投资本,"SDIC Capital Co., Ltd",上海证券交易所,Shanghai Stock Exchange,0.073
2026-03-31,000300,沪深300,CSI 300,600066,宇通客车,Zhengzhou Yutong Bus Co Ltd,上海证券交易所,Shanghai Stock Exchange,0.196
2026-03-31,000300,沪深300,CSI 300,600085,同仁堂,Beijing Tongrentang Co Ltd,上海证券交易所,Shanghai Stock Exchange,0.078
2026-03-31,000300,沪深300,CSI 300,600089,特变电工,TBEA Co Ltd,上海证券交易所,Shanghai Stock Exchange,0.551
2026-03-31,000300,沪深300,CSI 300,600104,上汽集团,SAIC Motor Co Ltd,上海证券交易所,Shanghai Stock Exchange,0.276
2026-03-31,000300,沪深300,CSI 300,600111,北方稀土,"China Northern Rare Earth (Group) High-Tech Co.,Ltd",上海证券交易所,Shanghai Stock Exchange,0.497
2026-03-31,000300,沪深300,CSI 300,600115,中国东航,"China Eastern Airlines Co., Ltd.",上海证券交易所,Shanghai Stock Exchange,0.149
2026-03-31,000300,沪深300,CSI 300,600150,中国船舶,China CSSC Holdings Limited,上海证券交易所,Shanghai Stock Exchange,0.573
2026-03-31,000300,沪深300,CSI 300,600160,巨化股份,Zhejiang Ju Hua Co Ltd,上海证券交易所,Shanghai Stock Exchange,0.19
2026-03-31,000300,沪深300,CSI 300,600161,天坛生物,Beijing Tiantan Biological Products Co Ltd,上海证券交易所,Shanghai Stock Exchange,0.061
2026-03-31,000300,沪深300,CSI 300,600176,中国巨石,"CHINA JUSHI CO., LTD.",上海证券交易所,Shanghai Stock Exchange,0.24
2026-03-31,000300,沪深300,CSI 300,600183,生益科技,"Shengyi Technology Co.,Ltd.",上海证券交易所,Shanghai Stock Exchange,0.271
2026-03-31,000300,沪深300,CSI 300,600188,兖矿能源,Yankuang Energy Group Company Limited,上海证券交易所,Shanghai Stock Exchange,0.142
2026-03-31,000300,沪深300,CSI 300,600196,复星医药,Shanghai Fosun Pharmaceutical (Group) Co Ltd,上海证券交易所,Shanghai Stock Exchange,0.139
2026-03-31,000300,沪深300,CSI 300,600219,南山铝业,"Shandong Nanshan Aluminium Co., Ltd.",上海证券交易所,Shanghai Stock Exchange,0.176
2026-03-31,000300,沪深300,CSI 300,600233,圆通速递,"YTO Express Group Co.,Ltd.",上海证券交易所,Shanghai Stock Exchange,0.142
2026-03-31,000300,沪深300,CSI 300,600276,恒瑞医药,Jiangsu Hengrui Medicine Co Ltd,上海证券交易所,Shanghai Stock Exchange,1.015
2026-03-31,000300,沪深300,CSI 300,600309,万华化学,"Wanhua Chemical Group Co., Ltd.",上海证券交易所,Shanghai Stock Exchange,0.614
2026-03-31,000300,沪深300,CSI 300,600346,恒力石化,"Hengli Petrochemical Co.,Ltd.",上海证券交易所,Shanghai Stock Exchange,0.188
2026-03-31,000300,沪深300,CSI 300,600362,江西铜业,Jiangxi Copper Co Ltd,上海证券交易所,Shanghai Stock Exchange,0.184
2026-03-31,000300,沪深300,CSI 300,600372,中航机载,"AVIC Airborne Systems Co., Ltd.",上海证券交易所,Shanghai Stock Exchange,0.129
2026-03-31,000300,沪深300,CSI 300,600377,宁沪高速,Jiangsu Expressway Co Ltd,上海证券交易所,Shanghai Stock Exchange,0.025
2026-03-31,000300,沪深300,CSI 300,600406,国电南瑞,"NARI Technology Co., Ltd.",上海证券交易所,Shanghai Stock Exchange,0.43
2026-03-31,000300,沪深300,CSI 300,600415,小商品城,Zhejiang China Commodities City Group Co Ltd,上海证券交易所,Shanghai Stock Exchange,0.146
2026-03-31,000300,沪深300,CSI 300,600426,华鲁恒升,Shandong Hualu-Hengsheng Chemical Co Ltd,上海证券交易所,Shanghai Stock Exchange,0.221
2026-03-31,000300,沪深300,CSI 300,600436,片仔癀,Zhangzhou Pientzehuang Pharmaceutical Co Ltd,上海证券交易所,Shanghai Stock Exchange,0.188
2026-03-31,000300,沪深300,CSI 300,600438,通威股份,Tongwei Co Ltd,上海证券交易所,Shanghai Stock Exchange,0.184
2026-03-31,000300,沪深300,CSI 300,600460,士兰微,Hangzhou Silan Microelectronics Co Ltd,上海证券交易所,Shanghai Stock Exchange,0.122
2026-03-31,000300,沪深300,CSI 300,600482,中国动力,"China Shipbuilding Industry Group Power Co.,Ltd",上海证券交易所,Shanghai Stock Exchange,0.145
2026-03-31,000300,沪深300,CSI 300,600489,中金黄金,Zhongjin Gold Co Ltd,上海证券交易所,Shanghai Stock Exchange,0.32
2026-03-31,000300,沪深300,CSI 300,600515,海南机场,"Hainan Airport Infrastructure Co., Ltd",上海证券交易所,Shanghai Stock Exchange,0.085
2026-03-31,000300,沪深300,CSI 300,600519,贵州茅台,Kweichow Moutai Co Ltd,上海证券交易所,Shanghai Stock Exchange,3.737
2026-03-31,000300,沪深300,CSI 300,600522,中天科技,Jiangsu Zhongtian Technologies Co Ltd,上海证券交易所,Shanghai Stock Exchange,0.338
2026-03-31,000300,沪深300,CSI 300,600547,山东黄金,Shandong Gold-Mining Co Ltd,上海证券交易所,Shanghai Stock Exchange,0.299
2026-03-31,000300,沪深300,CSI 300,600570,恒生电子,Hundsun Technologies Inc.,上海证券交易所,Shanghai Stock Exchange,0.159
2026-03-31,000300,沪深300,CSI 300,600584,长电科技,"JCET Group Co., Ltd.",上海证券交易所,Shanghai Stock Exchange,0.228
2026-03-31,000300,沪深300,CSI 300,600585,海螺水泥,Anhui Conch Cement Co Ltd,上海证券交易所,Shanghai Stock Exchange,0.229
2026-03-31,000300,沪深300,CSI 300,600588,用友网络,"Yonyou Network Technology Co., Ltd.",上海证券交易所,Shanghai Stock Exchange,0.098
2026-03-31,000300,沪深300,CSI 300,600600,青岛啤酒,Tsingtao Brewery Co Ltd,上海证券交易所,Shanghai Stock Exchange,0.09
2026-03-31,000300,沪深300,CSI 300,600660,福耀玻璃,"Fuyao Glass Industry Group Co.,Ltd",上海证券交易所,Shanghai Stock Exchange,0.376
2026-03-31,000300,沪深300,CSI 300,600674,川投能源,Sichuan Chuantou Energy Co Ltd,上海证券交易所,Shanghai Stock Exchange,0.119
2026-03-31,000300,沪深300,CSI 300,600690,海尔智家,"Haier Smart Home Co., Ltd.",上海证券交易所,Shanghai Stock Exchange,0.33
2026-03-31,000300,沪深300,CSI 300,600741,华域汽车,HUAYU Automotive Systems Company Limited,上海证券交易所,Shanghai Stock Exchange,0.125
2026-03-31,000300,沪深300,CSI 300,600760,中航沈飞,AVIC SHENYANG AIRCRAFT COMPANY LIMITED,上海证券交易所,Shanghai Stock Exchange,0.172
2026-03-31,000300,沪深300,CSI 300,600795,国电电力,GD Power Development Co Ltd,上海证券交易所,Shanghai Stock Exchange,0.178
2026-03-31,000300,沪深300,CSI 300,600803,新奥股份,"ENN Ecological Holdings Co., Ltd.",上海证券交易所,Shanghai Stock Exchange,0.085
2026-03-31,000300,沪深300,CSI 300,600809,山西汾酒,Shanxi Xinghuacun Fen Wine Factory Co Ltd,上海证券交易所,Shanghai Stock Exchange,0.287
2026-03-31,000300,沪深300,CSI 300,600845,宝信软件,Shanghai Baosight Software Co Ltd,上海证券交易所,Shanghai Stock Exchange,0.081
2026-03-31,000300,沪深300,CSI 300,600875,东方电气,Dongfang Electric Corporation Limited,上海证券交易所,Shanghai Stock Exchange,0.176
2026-03-31,000300,沪深300,CSI 300,600886,国投电力,"SDIC Power Holdings Co.,Ltd.",上海证券交易所,Shanghai Stock Exchange,0.14
2026-03-31,000300,沪深300,CSI 300,600887,伊利股份,Inner Mongolia Yili Industrial Group Co Ltd,上海证券交易所,Shanghai Stock Exchange,0.686
